fatalities,injured,evacuated,estimated_total_cost,normalized_total_cost,federal_payments,provincial_payments,insurance_payments,start_day,start_week,start_month,start_year,start_weekend,start_season_canada,end_day,end_week,end_month,end_year,end_weekend,end_season_canada,disaster_type,disaster_subgroup,disaster_group,disaster_category,magnitude,utility_people_affected,city,province,country,canada,summary
2,0,1400,,,,,,4,52,12,1999,f,Winter,4,52,12,1999,f,Winter,Derailment Release,Hazardous Chemicals,Technology,Incident,0,0,St-Hilaire,QC,Canada,t,"St-Hilaire QC, December 30, 1999.  Two trains collided when the eleventh wagon of the Ultra-train derailed and hit an oncoming train. The Ultra-Train is a convoy of 68 wagons in four sections of 17 wagons linked by hoses.  It is about one kilometre long, and acts as a “pipeline on rail” between St-Romuald and Montreal.  Due to the petroleum products it was carrying, a series of explosions were set off and black smoke was left in the air.  Two train operators were killed, while 1400 people were evacuated from the towns of Mont-St-Hilaire, Beloeil and Ste-Madeleine.  The evacuees were allowed to return home the next day."
0,0,216,6621462,416444.2,3059340,3075338,,1,3,1,2000,f,Winter,6,3,1,2000,t,Winter,Winter Storm,Meteorological - Hydrological,Natural,Disaster,0,0,,,Canada,t,"Maritime Provinces, January 17-22, 2000.  An intense storm hit the maritimes for 6 days. Up to 70 centimetres of snow fell in some areas and temperatures plummeted to Â–40 degrees Centigrade with the wind chill.  Flooding caused extensive damage to private property and public infrastructure in Newfoundland, New Brunswick, and P.E.I. Wind gusts hit 120 kilometres per hour.  Cape Breton, Shediac, New Brunswick and P.E.I were hit especially hard by the storm, as well as areas along the Gulf of St. Laurence and the Northumberland Strait in New Brunswick."
0,0,0,0,0,,,,4,15,4,2000,f,Spring,5,15,4,2000,f,Spring,Landslide,Geological,Natural,Disaster,0,0,Passmore,BC,Canada,t,"Passmore BC, April 13-14, 2000.  Two mudslides slid 320 metres down a mountainside, totalling about 150,000 cubic metres of dirt, rock and trees.  The slides buried the highway just south of Passmore in the Slocan Valley.  The mudslide toppled power lines, leaving about 4,000 residents without electricity and long distance phone service.  No one was injured in either slide."
0,1,0,0,0,,,,4,16,4,2000,f,Spring,5,16,4,2000,f,Spring,Storms and Severe Thunderstorms,Meteorological - Hydrological,Natural,Disaster,0,0,Southern,ON,Canada,t,"Southern Ontario, April 20-21, 2000.  The Windsor area registered 95 mm of rain in a 24-hour period and the storm dumped almost 70 mm of rain on the London area, Sarnia got 50 mm, while 40 mm fell on the Toronto area.  Sewers were backed up and roads washed out, and many short power outages occurred.  One child suffered injuries in Toronto due to violent winds, which gusted up to 80 km/h."
12,140,1000,3385331,212913.9,190216,3195115,,5,28,7,2000,f,Summer,5,28,7,2000,f,Summer,Tornado,Meteorological - Hydrological,Natural,Disaster,0,0,Pe Lake,AB,Canada,t,"Pine Lake AB, July 14, 2000.  A tornado hit Pine Lake at 300 kilometres an hour, killing 12 people and injuring more than 140.  Close to one-thousand people were displaced from a campsite as their recreational vehicles were damaged."
0,0,0,0,0,,,,2,31,8,2000,f,Summer,2,31,8,2000,f,Summer,Leak / Spill Release,Hazardous Chemicals,Technology,Incident,0,0,Chetwynd,BC,Canada,t,"Chetwynd BC, August 1, 2000.  An oil pipeline break released approximately 1 million litres of crude oil into the Pine River, causing extensive fish kill in the Pine River.  The wells that supply drinking water to some of the farms located along the river have been contaminated.  The Pine River water intake was turned off to avoid potential water system contamination."
0,0,0,2917561,183494.4,885581,2031980,,5,27,7,2000,f,Summer,5,28,7,2000,f,Summer,Flood,Meteorological - Hydrological,Natural,Disaster,0,0,Southern,MB,Canada,t,"Southern Manitoba, July 7-14, 2000.   Heavy rains occurred throughout July causing major problems in some areas.  On July 7, between 80 -100 millimetres of rain fell in a four hour time-frame, washing out roads and flattening crops.  Winds reached almost 125 km/h, and lightning strikes reached up to 1,000 hits an hour.  The prolonged rainfall resulted in saturated soil, and overland flooding across the province with reports of flooded basements, blocked drainage systems, and backed-up sewers."
0,0,0,0,0,0,0,,7,43,10,2000,t,Autumn,7,43,10,2000,t,Autumn,Storm Surge,Meteorological - Hydrological,Natural,Disaster,0,0,,,Canada,t,"Eastern and Northern Coastline of New Brunswick, October 29, 2000.  Extensive damage occurred during a severe storm surge with winds in excess of 130 km/h.  Private property, businesses and public infrastructure were damaged along the eastern and northern coast of New Brunswick.  The emerging shellfish aquaculture industry (which includes mussels, oysters and clams) was also greatly affected."
0,1,800,5627843,353952.4,449218,3328625,,4,44,11,2000,f,Autumn,6,45,11,2000,t,Autumn,Flood,Meteorological - Hydrological,Natural,Disaster,0,0,Sydney,NS,Canada,t,"Sydney NS, November 2-11, 2000.  Heavy rains hit Cape Breton and Victoria County for nearly ten days, causing flooding and damages to homes and businesses.  Almost 100 millimetres of rain fell in a 24-hour period, flooding streets and forcing the evacuation of 200 families.  One woman was trapped in her car and suffered injuries when a massive culvert collapsed due water pressure.  A boil order was in effect for a week for 1,000 residents in Donkin and at least 2 weeks for the 30,000 residents of Glace Bay, Reserve Mines and Dominion."
6,21,0,0,0,,,,1,48,11,2000,f,Autumn,1,48,11,2000,f,Autumn,Vehicle,Transportation accident,Technology,Incident,0,0,Rogers Pass,BC,Canada,t,"Rogers Pass BC, November 27, 2000.  A bus carrying tourists from Taiwan crashed head-on with a transport truck in a tunnel on the Trans-Canada Highway, killing six and injuring 21.  The accident happened in the 316-metre Lanark snowshed tunnel, closing the highway for about 14 hours.  The transport truck was empty at the time of the accident."
6,11,30,0,0,,,,6,6,2,2001,t,Winter,6,6,2,2001,t,Winter,Winter Storm,Meteorological - Hydrological,Natural,Disaster,0,0,,QC,Canada,t,"Quebec, February 10, 2001. Freezing rain, heavy snow and wind caused road accidents and homelessness. Six died in weather-related motor vehicle accidents."
,,,16710626,1025191.8,7045162,3876935,,7,13,4,2001,t,Spring,7,13,4,2001,t,Spring,Flood,Meteorological - Hydrological,Natural,Disaster,0,0,Southern,MB,Canada,t,"Southern Manitoba, April 2001.  Southern Manitoba suffered significant losses during spring flooding.  Highway infrastructures, businesses and private and public properties were extensively damaged."
0,0,0,0,0,,,,5,22,6,2001,f,Winter,2,40,10,2002,f,Autumn,Drought,Meteorological - Hydrological,Natural,Disaster,0,0,Across Canada,SK,Canada,t,"Across Canada, concentrated in Saskatchewan and Alberta, Spring 2001 to Fall 2002.  A severe drought was felt across all Canada, affecting 41,000 people, with the most devastating impacts felt in Saskatchewan and Alberta.  Record to near-record drought, as indicated by the Palmer Drought Severity Index, was recorded at several climate stations in 2001.  The winter of 2001-2002 continued the dry trend and brought above normal temperatures.  Fall 2002 brought much needed precipitation to relieve much of the drought, though dry conditions did remain in places.  The repercussions of the drought included agricultural production, employment, crop and livestock production, and the Gross Domestic Product."
,,,20942391,1284809.3,10691352,10251039,,5,22,6,2001,f,Winter,5,22,6,2001,f,Winter,Flood,Meteorological - Hydrological,Natural,Disaster,0,0,Peace River area,BC,Canada,t,"Peace River area BC, June 2001.  The region was subjected to many intense precipitation events.  Increased tributary levels combined with the spring freshet caused the over-saturation of the soil and surface runoff.  This in turn triggered several landslides that cut-off highways.  Property and infrastructure damage was extensive. Pink Mountain and Halfway River were both affected."
0,0,0,869596,53349.4,,869596,,2,31,7,2001,f,Summer,2,31,7,2001,f,Summer,Storms and Severe Thunderstorms,Meteorological - Hydrological,Natural,Disaster,0,0,Morley,ON,Canada,t,"Morley, Chapple, Dawson, Emo, Lake of the Woods, La Vallee, Rainy River, Fort Frances ON, July 31, 2001.  A severe summer storm hit eight municipalities and two rural areas in northwestern Ontario.  These were declared disaster areas, and the damages were covered by the Ontario government.  Effects of the storm include fallen trees, washed out roads, tossed boats, and broken docks."
0,0,,9323887,572017.6,2622744,6701143,,7,26,7,2001,t,Summer,7,26,7,2001,t,Summer,Flood,Meteorological - Hydrological,Natural,Disaster,0,0,,,Canada,t,"Northeast and Central British Columbia, July 2001.  A severe five-day rainstorm caused flood damage to 100 homes and to critical infrastructure.  More than 200 mm of rain fell.  Roads and bridges were washed out, businesses and public and private properties were damaged, two trains derailed, and people were temporarily stranded."
24,,,0,0,,,,2,37,9,2001,f,Autumn,2,37,9,2001,f,Autumn,Air,Hijacking,Conflict,Incident,0,0,,,Canada,t,"New York City, NY, U.S.A., September 11, 2001. Twenty-four Canadians were killed when terrorists crashed two commercial airliners into the towers of the World Trade Center. One Canadian was aboard each of the two hijacked aircraft. The other 22 Canadians were among the 2 823 people killed in the subsequent collapse of both towers."
,,100,0,0,,,,7,15,4,2002,t,Spring,7,15,4,2002,t,Spring,Non-Residential,Explosion,Technology,Incident,0,0,Brookdale,MB,Canada,t,"Brookdale MB, April 14, 2002.  A rupture occurred on the 914-mm natural gas transmission Line 100-3 (main line) of TransCanada Pipelines 2 km from the village of Brookdale, Manitoba.  There were no injuries, damage or fatalities noted in the area. Approximately 100 people within a 4 km radius were evacuated by the RCMP.  On April 25, 2002 TransCanada completed the repairs and Line 100-3 was fully restored to normal service on July 5, 2002. "
0,0,129,32332,1939.9,,19779,,1,21,5,2002,f,Spring,3,21,5,2002,f,Spring,Wildfire,Meteorological - Hydrological,Natural,Disaster,0,0,Montreal Lake,SK,Canada,t,"Montreal Lake SK, May 20-22, 2002.  Extreme burning conditions existed throughout Saskatchewan at this time.  Winds gusting at 50 to 60 km/h aided the spread of fires (around 48 in total), mostly in grasses and brush.  This specific fire was first spotted around the Bittern Lake area and was moving north towards the eastern part of the community of Montreal Lake.  Approximately 130 evacuees from this community and the Montreal Lake Cree Nation were moved to Prince Albert.  "
,,,0,0,0,0,,1,21,5,2002,f,Spring,1,21,5,2002,f,Spring,Flood,Meteorological - Hydrological,Natural,Disaster,0,0,,,Canada,t,"British Columbia, May 2002.  High snow-pack levels, rapid melting and heavy rainfall caused severe runoff and flooding in areas of B.C. except Vancouver Island and the Central Coast. The spring freshet caused significant damage to private properties, public transportation corridors, and recreation facilities."
0,0,300,0,0,,,,4,22,5,2002,f,Spring,4,22,5,2002,f,Spring,Residential,Fire,Technology,Incident,0,0,Calgary,AB,Canada,t,"Calgary AB, May 5, 2002.  Fire gutted the Waterford Complex, a condominium development near downtown Calgary."
0,0,1200,0,0,,,,3,18,5,2002,f,Spring,3,18,5,2002,f,Spring,Flood,Meteorological - Hydrological,Natural,Disaster,0,0,Attawapiskat First Nation,ON,Canada,t,"Attawapiskat FN, ON, May 2002. Approximately 1200 people were evacuated to Moosonee and Timmins following the flooding of the Attawapiskat River. A municipal state of emergency was declared."
0,0,0,6975854,418551.2,,6975854,,7,23,6,2002,t,Winter,7,23,6,2002,t,Winter,Flood,Meteorological - Hydrological,Natural,Disaster,0,0,Municipalities of Ignace,ON,Canada,t,"Municipalities of Ignace, Fort Frances, Rainy River, Alberton, Atikokan, Chapple, Dawson, Emo, La Valle, Lake of the Woods, Morley, Machin; Township of Sioux-Narrows - Nestor Falls ON, June 9-11, 2002.  Parts of northwestern Ontario were declared disaster areas because of severe flooding. Roads and highways were washed out and closed, power and telecommunication lines were disrupted, and private properties were greatly damaged."
0,0,350,16054182,963250.9,8834091,7220091,,2,24,6,2002,f,Winter,2,24,6,2002,f,Winter,Flood,Meteorological - Hydrological,Natural,Disaster,0,0,Southern,AB,Canada,t,"Southern AB, June 11, 2002.  Approximately 280 mm of rain fell on the area within a few days.  The heavy rain and the unusually late spring runoff caused mudslides and forced sewage into river systems, and power lines were damaged in Waterton Lake National Park.  A local state of emergency was declared for the areas of: Pincher Creek, County of Warner, Village of Sterling, Village of Warner, Village of Foremost, and the Town of Coaldale.  Two hundred residents from the Blood First Nation and 150 residents from the Peigan First Nation were evacuated."
0,0,150,10376248,622574.9,3552493,5048976,,2,24,6,2002,f,Winter,2,24,6,2002,f,Winter,Flood,Meteorological - Hydrological,Natural,Disaster,0,0,Southeast,MB,Canada,t,"Southeast MB, June 11, 2002. Ten communities declared a state of emergency following severe flooding of homes and roads. About 240 mm of rain fell, causing the worst flooding southeast Manitoba had seen in 45 years. Levels of the Roseau River declined for a few days; however, additional flooding was expected the following week given the record water levels in the American portion of the river and the expected crest in southeast Manitoba. Residents and flood workers built dikes and laid sandbags as a preventative measure in the event of further flooding. Several roads were closed and some of these washed out or were covered with water. Crops were severely damaged because fields were submerged under water, and homes were inundated."
0,0,2500,0,0,,,,5,25,6,2002,f,Winter,5,25,6,2002,f,Winter,Non-Residential,Fire,Technology,Incident,0,0,Kgsville,ON,Canada,t,"Kingsville ON, June 21, 2002. Four million pounds of styrene incinerated."
0,0,600,0,0,,,,7,25,6,2002,t,Winter,7,25,6,2002,t,Winter,Wildfire,Meteorological - Hydrological,Natural,Disaster,0,0,Peerless Lake,AB,Canada,t,"Peerless Lake and Trout Lake AB, June 23, 2002.  The Peerless Lake Complex involved three separate fires within a small area approximately 155 km north of Slave Lake. These three fires forced the MD of Opportunity No. 17 to evacuate approximately 600 people to Red Earth.  The wild fires consumed a total of 15,438 ha of forest. "
0,0,425,31014,1860.8,,31014,,1,26,6,2002,f,Winter,1,26,6,2002,f,Winter,Wildfire,Meteorological - Hydrological,Natural,Disaster,0,0,Turnor Lake,SK,Canada,t,"Turnor Lake SK, June 25, 2002. Three hundred and fifty residents of Turnor Lake, located 600 km northwest of Saskatoon, were evacuated to nearby towns. The fire was charged by exceptionally dry and hot weather, and winds pushed the fire towards Turnor Lake. Water bombers continuously dropped their payload on the fire, while the town buildings and trees were showered by industrial sprinkler systems."
0,0,103,0,0,,,,5,26,6,2002,f,Winter,7,26,6,2002,t,Winter,Wildfire,Meteorological - Hydrological,Natural,Disaster,0,0,Hawes/Patuanak,SK,Canada,t,"Hawes/Patuanak SK, June 28-30, 2002. One hundred three evacuated."
0,0,480,0,0,,,,5,26,6,2002,f,Winter,1,27,7,2002,f,Summer,Wildfire,Meteorological - Hydrological,Natural,Disaster,0,0,Crutwell,SK,Canada,t,"Crutwell, Dillon, Hatchett Lake, Pelican Narrows, Deschambeault, Wahpeton First Nation, Nordell, Peter Pond SK, June 28 - July 1, 2002. Five hundred six evacuated."
0,0,628,0,0,,,,2,27,7,2002,f,Summer,2,27,7,2002,f,Summer,Wildfire,Meteorological - Hydrological,Natural,Disaster,0,0,Nemiscau region,QC,Canada,t,"Nemiscau region, near James Bay QC, July 2, 2002. Of 50 forest fires burning in Quebec around this time, the Nemiscau fire was the most noticeable.  The fire travelled within 800 metres of the native village of Nemaska. A total of 630 Chisasibi and Nemiscau-region residents were evacuated. The fire was ignited by intense thunder and lightning storms and destroyed over 600 km2 of forest. Consequently, 6000 Quebec forestry workers were laid-off. Hydro-Quebec disconnected its service to 500 000 people given the proximity of the fire to a major power line. Smoke could be seen in most of Quebec, parts of Ontario, and the northeastern United States."
0,0,912,464286,27857.2,,464286,,3,27,7,2002,f,Summer,3,27,7,2002,f,Summer,Wildfire,Meteorological - Hydrological,Natural,Disaster,0,0,Near community of Sheshatshui,NL,Canada,t,"Near the community of Sheshatshui and the Town of North West River NL, July 3, 2002.  A forest fire ignited 10-12 km from the community of Sheshatshui and the Town of North West River. Approximately 1200 residents were evacuated to the town of Happy Valley-Goose Bay. The fire burned 3km2 of forest."
0,0,350,0,0,,,,2,31,7,2002,f,Summer,2,31,7,2002,f,Summer,Leak / Spill Release,Hazardous Chemicals,Technology,Incident,0,0,Dryden,ON,Canada,t,"Dryden ON, July 30, 2002. A chlorine dioxide leak at a nearby paper mill caused 300 to 400 people to be evacuated from the immediate downwind area."
0,0,985,0,0,,,,1,27,7,2002,f,Summer,1,27,7,2002,f,Summer,Wildfire,Meteorological - Hydrological,Natural,Disaster,0,0,Kee-Way-W FN; Townships of Terrace Bay,ON,Canada,t,"Kee-Way-Win FN; Townships of Terrace Bay and Schrieber; Village of Rossport; Pays Plat FN; Deer Lake FN, ON, July 2002. Members of several communities were concerned by nearby fires and smoke. More than 1000 people were evacuated to Thunder Bay, Geraldton and Sioux Lookout. Municipal emergency declarations occurred in six communities."
1,0,120,0,0,,,,6,46,11,2002,t,Autumn,6,46,11,2002,t,Autumn,Rail,Transportation accident,Technology,Incident,0,0,Brantford,ON,Canada,t,"Brantford ON, November 16, 2002.  Eight train cars were derailed as a result of a collision with a van. The derailed cars rolled down an embankment that adjoined a neighbourhood, causing 120 people from the immediate area to be evacuated for two days. There were no leaks reported, but the cars contained a residue of butylene and butane."
30,,2,,,,,,2,4,1,2003,f,Winter,2,4,1,2003,f,Winter,Avalanche,Meteorological - Hydrological,Natural,Disaster,0,0,,,Canada,t,"Golden, Fernie, Valemount, Nelson, Revelstoke, Durrand Glacier BC and Rogers Pass, Connaught Creek Valley, Okotoks, Mt. Terry Fox, Lake Louise, Rocky Mountains AB, January – April 2003.  Deadly avalanche season since 1970 claimed 30 lives in Western Canada.  The higher death toll was in part due to unusual weather patterns brought by an El Nino winter."
,2,300,,,,,,5,8,2,2003,f,Winter,5,8,2,2003,f,Winter,Rail,Transportation accident,Technology,Incident,0,0,Tyendaga Township First Nation,ON,Canada,t,"Tyendenaga Township First Nation ON, February 21, 2003. Two Canadian Pacific freight trains carrying hazardous materials collided, derailed and exploded in Tyendenaga Township First Nation near Melrose, Ontario.  Two crewmembers were injured and approximately 300 people were forced to leave their homes.  The township declared a state of emergency and ordered evacuation within a 2 km area of the site.  "
0,,,1869114,109092.3,1869114,,,1,14,3,2003,f,Spring,1,14,3,2003,f,Spring,Winter Storm,Meteorological - Hydrological,Natural,Disaster,0,0,,,Canada,t,"Prince Edward Island, March 31, 2003.  Both freezing rain and heavy snowfall destroyed power lines in the province. Power losses were experienced in western PEI. The province also experienced flooding as a result of heavy rainfall that contributed to the spring runoff. See Nova Scotia and Newfoundland entries for more information on this event."
0,0,0,2381905,139021.7,1869114,512791,,1,14,3,2003,f,Spring,1,14,3,2003,f,Spring,Flood,Meteorological - Hydrological,Natural,Disaster,0,0,,,Canada,t,"Prince Edward Island, March 31, 2003.  The province was subjected to a severe rainstorm causing flooding and resulting in damage to both private and public property."
,,500,,,,,,1,21,5,2003,f,Spring,1,21,5,2003,f,Spring,Wildfire,Meteorological - Hydrological,Natural,Disaster,0,0,Eastern Passage,NS,Canada,t,"Cole Harbour, Eastern Passage NS, May 19, 2003.  A forest fire started in a bog near Cole Harbour.  High winds and dry conditions helped the fire spread out of control burning 240 hectares and forcing the evacuation of 240 homes.  Approximately 500 people were evacuated near Eastern Passage in northeast of Halifax.  No damage or injuries reported."
,,48501,159052448,9283216.8,159052448,,,2,27,7,2003,f,Summer,7,35,8,2003,t,Summer,Wildfire,Meteorological - Hydrological,Natural,Disaster,0,0,Southeastern British Columbia,AB,Canada,t,"Southeastern British Columbia and Southwestern Alberta; July and August 2003.  Dozens of communities were evacuated due to wildfires started by lightning and careless fire use.  Over 50,000 people were evacuated and firefighting costs alone are estimated at $400 million dollars."
0,,100,121846,7111.6,39640,82206,,1,30,7,2003,f,Summer,1,30,7,2003,f,Summer,Wildfire,Meteorological - Hydrological,Natural,Disaster,0,0,Norman Wells,Northwest Territories,Canada,t,"Norman Wells, NT, July 21, 2003. Lightening started a fire in an on old-growth black spruce forest approximately 17 km from Norman Wells. The fire was sustained by high temperatures and gusting winds. Norman Wells declared a state of emergency. About 100 people were evacuated due to thick smoke. Those with respiratory problems, the elderly, and the young were evacuated by plane to Inuvik while others were sent to nearby communities via boat."
,,,,,,,,4,33,8,2003,f,Summer,4,33,8,2003,f,Summer,Energy,Infrastructure failure,Technology,Incident,0,0,,,Canada,t,"Ontario, Midwest and Northeast USA, August 14, 2003. Approximately 50 million (over 9 million in Ontario) people were affected by a blackout, some experiencing power outages for over 48 hours. A combination of employee, equipment, and monitoring failures ultimately led to the blackout. The initial triggering power outage was prompted by contact between sagging transmission lines and untrimmed trees in Ohio."
8,,,25529656,1490057.7,25529656,,,1,40,9,2003,f,Autumn,1,40,9,2003,f,Autumn,Hurricane / Typhoon / Tropical Storm,Meteorological - Hydrological,Natural,Disaster,0,0,Halifax,NS,Canada,t,"Halifax NS and Charlottetown PE, September 29, 2003. At 00:10 AST, Hurricane Juan made landfall in Nova Scotia as one of the most powerful and damaging hurricanes to impact Canada.  A 1.63 metre storm surge occurred while Juan made landfall just south of Halifax as a Class 2 hurricane. Water levels reached 2.9 metres above chart datum, which was the highest water level recorded to date at this location. Winds gusted to 230 km/h in Halifax and waves outside Halifax Harbour reached a maximum height of 19 metres. Extensive damage to buildings, docks, boardwalks and trails occurred throughout Nova Scotia and Prince Edward Island. Point Pleasant Park in Halifax was decimated; nearly every tree in the 75-hectare park was damaged or uprooted. Juan knocked out power to hundreds of thousands of people. It is estaimated that up to 300,000 people lost power due to the strong winds. In addition, eight lives were lost either directly or indirectly as a result of Hurricane Juan."
2,1,750,8958966,522896.8,8958966,,,4,42,10,2003,f,Autumn,4,43,10,2003,f,Autumn,Flood,Meteorological - Hydrological,Natural,Disaster,0,0,,,Canada,t,"Vancouver Island and Southwestern British Columbia, October 16-23, 2003. Heavy rains resulted in major flooding, particularly to Squamish and Pemberton where states of emergency were declared. Flooding in the Squamish Valley, Cheakamus Valley, and Paradise Valley resulted in the evacuation of 700 people from those areas. Another 50 people were evacuated from the Vancouver Island region. Two vehicles were swept into Rutherford Creek north of Whistler. One passenger survived, while two died."
0,0,,3687690,211328.9,3687690,,,3,8,2,2004,f,Winter,5,8,2,2004,f,Winter,Winter Storm,Meteorological - Hydrological,Natural,Disaster,0,0,,,Canada,t,"Nova Scotia, February 18-20, 2004. A snowstorm known as White Juan hit the Maritimes resulting in record-breaking snowfall. On February 19, Halifax surpassed and almost doubled its previous snowfall record when the city received 88.5 cm. A four-day state of emergency was in place as well as a nine-hour curfew for three nights (except for essential workers). Thousands were left without power."
,,1700,5700000,326647.6,5700000,,,3,21,5,2004,f,Spring,3,21,5,2004,f,Spring,Flood,Meteorological - Hydrological,Natural,Disaster,0,0,Attawapiskat,ON,Canada,t,"Attawapiskat ON, May 19, 2004.  Due to ice-jam flooding in the Attawapiskat River, approximately 1,700 people from the  James Bay Cree First Nation community of Attawapiskat were evacuated by air to Moosonee, Cochrane and Timmins.  "
0,0,0,0,0,,,,4,28,7,2004,f,Summer,4,28,7,2004,f,Summer,Tornado,Meteorological - Hydrological,Natural,Disaster,0,0,Gre Prairie,AB,Canada,t,"Grande Prairie AB, July 8, 2004. A tornado swept through the city of Grand Prairie turning over cars and causing damages to homes and businesses. Environment Canada reported the tornado as a funnel cloud, although a tornado advisory was in place at the time. The tornado touched down at 15:30 MST and passed through the city’s downtown core. Damages included a downed power line that caused a small fire in a hotel, the destruction of a Kentucky Fried Chicken restaurant as well as numerous homes with damaged roofs, doors and windows."
