fatalities,injured,evacuated,estimated_total_cost,normalized_total_cost,federal_payments,provincial_payments,insurance_payments,start_day,start_week,start_month,start_year,start_weekend,start_season_canada,end_day,end_week,end_month,end_year,end_weekend,end_season_canada,disaster_type,disaster_subgroup,disaster_group,disaster_category,magnitude,utility_people_affected,city,province,country,canada,summary
0,0,0,,,0,0,,4,28,7,1983,f,Summer,3,35,8,1983,f,Summer,Drought,Meteorological - Hydrological,Natural,Disaster,0,0,,ON,Canada,t,"Ontario, 1983. Heat and drought stress resulted in low crop yields in Ontario.  Heat caused roads and a rail to buckle on Aug. 3.  The latter spilled 6 CP Rail freight cars carrying grain and 1 car carrying steel rails into the Cypress River."
23,18,0,,,0,0,,4,22,6,1983,f,Winter,4,22,6,1983,f,Winter,Air,Transportation accident,Technology,Incident,0,0,,,Canada,t,"Cincinnati Ohio USA, June 2, 1983. An Air Canada DC-9 was destroyed when it caught fire en route to Toronto from Texas and landed in flames at Cincinnati airport."
0,0,0,,,0,0,,5,25,6,1983,f,Winter,5,25,6,1983,f,Winter,Storms and Severe Thunderstorms,Meteorological - Hydrological,Natural,Disaster,0,0,Rega,SK,Canada,t,"Regina SK and Edmonton AB, June 24, 1983."
,,,,,,,,1,9,2,1983,f,Winter,4,10,3,1983,f,Spring,Flood,Meteorological - Hydrological,Natural,Disaster,0,0,Badger,NL,Canada,t,"Badger NL, February 27 - March 10, 1983.  Severe flooding in Badger due to ice and debris blockages of the Exploits River. The town hall, fire hall and arena were flooded, and 34 homes evacuated. Badger was declared a disaster area."
0,0,160,,,0,0,,2,19,5,1983,f,Spring,2,19,5,1983,f,Spring,Flood,Meteorological - Hydrological,Natural,Disaster,0,0,upper Richelieu River,QC,Canada,t,"Upper Richelieu River QC, May 10, 1983. Plus several communities along the Ottawa River, Rivière Gatineau, Rivière du Lièvre, Rivière des Prairies, Rivière des Mille Îles, and Rivière Rouge were also affected; heavy rains of 70110 mm caused widespread flooding along the upper Richelieu River on May 10, 1983; from the city of Saint-Jean to the Canada-U.S. border, 640 homes and 373 cottages were flooded; approximately 160 people were evacuated."
0,0,0,20614195,2128832.5,1121298,3107897,16385000,5,27,7,1983,f,Summer,6,27,7,1983,t,Summer,Storms and Severe Thunderstorms,Meteorological - Hydrological,Natural,Disaster,0,0,Rega,SK,Canada,t,"Regina SK, July 8-9, 1983. Regina Airport received 50 mm of rain in one hour, and 117 mm in a 24 hour period, while northern Regina received up to 150 mm, with 83 mm coming in one hour; the storm overloaded the sewer system and caused severe flooding, mostly in basements."
0,0,0,22060000,2278141.1,0,0,22060000,3,31,8,1983,f,Summer,3,31,8,1983,f,Summer,Storm - Unspecified / Other,Meteorological - Hydrological,Natural,Disaster,0,0,Edmonton,AB,Canada,t,"Edmonton AB, August 3, 1983.  Hail the size of golf balls smashed windshields, stripped leaves and damaged roofs."
0,0,0,,,0,0,,2,43,10,1983,f,Autumn,2,43,10,1983,f,Autumn,Storm Surge,Meteorological - Hydrological,Natural,Disaster,0,0,Cape Breton Isl,NS,Canada,t,"Cape Breton Island NS, October 25, 1983. The eastern shores of Cape Breton Island were struck by a storm surge. Water levels rose to 0.761.5 m above the normal high water mark.  The storm flooded highways as well as destroying 30 fishing boats and thousands of lobster traps."
0,0,0,53831341,5559174.6,27739771,26091570,,3,49,12,1983,f,Winter,3,49,12,1983,f,Winter,Flood,Meteorological - Hydrological,Natural,Disaster,0,0,Gaspésie,QC,Canada,t,"Gaspésie and lower north shore of Gulf of St. Lawrence River QC, December 7-8, 1983. High tides and violent winds from a severe storm caused flooding along the Gaspésie and Gulf of St. Lawrence shores along with landslides; damage, partially wind related, was widespread; several wharves, ships, and roads were damage; several homes and cottages were flooded; the communities of Chandler, La Martre, Sainte-Anne-des-Monts and Longue-Pointe were affected."
0,0,0,0,0,0,0,,5,22,6,1984,f,Winter,5,35,8,1984,f,Summer,Drought,Meteorological - Hydrological,Natural,Disaster,0,0,,,Canada,t,"Prairie Provinces, 1984. The worst agricultural drought since the 1930s to occur in the Prairies; severe and widespread surface water droughts reported on the Prairies. Over 10,000 farms were affected."
0,0,0,,,0,0,,7,52,1,1984,t,Winter,7,52,1,1984,t,Winter,Cold Event,Meteorological - Hydrological,Natural,Disaster,0,0,,QC,Canada,t,"Quebec, 1984. Winterkill and excessive moisture caused forage losses."
0,0,0,,,0,0,,7,52,1,1984,t,Winter,7,52,1,1984,t,Winter,Tornado,Meteorological - Hydrological,Natural,Disaster,0,0,Gre Prairie,AB,Canada,t,"Grande Prairie and Drayton Valley AB, 1984."
0,0,200,,,0,0,,7,52,1,1984,t,Winter,7,52,1,1984,t,Winter,Fire,Hazardous Chemicals,Technology,Incident,0,0,Fort Frances,ON,Canada,t,"Fort Frances ON, 1984. Hundreds of people were evacuated from Fort Frances, Ontario."
0,0,0,,,0,0,,7,52,1,1984,t,Winter,7,52,1,1984,t,Winter,Flood,Meteorological - Hydrological,Natural,Disaster,0,0,Northeast,SK,Canada,t,"Northeast SK, 1984. Excessive moisture caused crop losses."
1,0,0,,,0,0,,7,5,2,1984,t,Winter,3,6,2,1984,f,Winter,Flood,Meteorological - Hydrological,Natural,Disaster,0,0,Truro,NS,Canada,t,"Truro NS, February 5-8, 1984. A combination of mild temperatures, rainfall, snowmelt and ice jams caused flooding in the Truro area; along the Salmon and North Rivers several homes were inundated; Feb. flood described as the worst in 50 years; one death from fumes while pumping out a basement."
0,0,0,4029790,398989.1,605407,3424383,,3,1,1,1984,f,Winter,4,1,1,1984,f,Winter,Flood,Meteorological - Hydrological,Natural,Disaster,0,0,Lower Fraser River Valley,BC,Canada,t,"Lower Fraser River Valley BC, January 4-5, 1984. Heavy rainfall and snowmelt caused flooding in southwestern British Columbia; transportation was disrupted as debris jams and water obstructed traffic on Highway 1; several problems were caused by flooding and washouts; there was a mudslide and a bridge washout, and sections of CP and CN railway track were washed out as well as damage to a fish hatchery."
2,0,150,,,0,0,,1,7,2,1984,f,Winter,5,7,2,1984,f,Winter,Flood,Meteorological - Hydrological,Natural,Disaster,0,0,Southern,ON,Canada,t,"Southern Ontario, February 13-17, 1984. Toronto, Chatham, Dresden, Port Bruce, St. Thomas, and Brantford experienced flooding due to very mild weather and rainfall; ice jams formed on several rivers causing them to overflow; several roads were closed due to flooding, most of them along the St. Clair and Thames River in the southeastern part of Ontario; in Toronto, the Don Valley Parkway was closed in areas due to overflow in the Don River; two people died as they were swept away on Black Creek in Toronto; over a hundred were evacuated in southern Ontario; utilities were disrupted in some areas and businesses were forced to close."
1,0,0,,,0,0,,3,17,4,1984,f,Spring,7,18,5,1984,t,Spring,Flood,Meteorological - Hydrological,Natural,Disaster,0,0,Sat John River Bas,NB,Canada,t,"Saint John River basin NB, April 25 - May 6, 1984. Due to rain, mild temperatures and snowmelt in late Apr. and early May, the Saint John River flooded areas between Fredericton and Gagetown; several houses were inundated and the TransCanada Highway was closed for several days;  one person was reported to have drowned when his vehicle left a flooded section of Route #690 near Lakeville Corner and plunged into deeper water."
0,0,0,2686465,265986.6,816031,1870434,,5,17,4,1984,f,Spring,6,17,4,1984,t,Spring,Winter Storm,Meteorological - Hydrological,Natural,Disaster,0,0,South,MB,Canada,t,"South, Central, and Western MB, April 27-28, 1984. Snow, freezing rain and strong wind gusts caused damage to roads, hydro poles and drainage facilities. Municipalities affected were: Grey, Dufferin, Pembina, Portage la Prairie, Stanley and Thompson. Towns affected were: Carman, Morden, Neepawa and Winkler."
0,0,0,1656780,164037.6,301190,1355590,,5,24,6,1984,f,Winter,2,31,7,1984,f,Summer,Storms and Severe Thunderstorms,Meteorological - Hydrological,Natural,Disaster,0,0,Southern,MB,Canada,t,"Southern Manitoba, June-July 1984. Southern Manitoba experienced severe rainstorms with hail, thunder, and lightening. In some cases, tornadoes were reported. The storms led to crop damages and flooding. The cities of Winnipeg and Brandon were particularly affected. "
0,0,0,39066000,3867920.8,0,0,39066000,1,18,4,1984,f,Spring,1,18,4,1984,f,Spring,Storm - Unspecified / Other,Meteorological - Hydrological,Natural,Disaster,0,0,Chesley,ON,Canada,t,"Chesley, Bruce County ON, April 30, 1984."
3,13,0,,,0,0,,2,19,5,1984,f,Spring,2,19,5,1984,f,Spring,Shootings,Terrorist,Conflict,Incident,0,0,Quebec City,QC,Canada,t,"Quebec City QC, May 8, 1984. A shooting occurred at the National Assembly of Québec. Three people were killed, 13 injured (4 badly, 2 had a nervous breakdown). The shooting initiated a psychological support program for employees, and heightened security measures."
0,1,,,,0,0,,5,18,5,1985,f,Spring,5,18,5,1985,f,Spring,Flood,Meteorological - Hydrological,Natural,Disaster,0,0,Hay River Township,Northwest Territories,Canada,t,"Hay River Township, south shore of Great Slave Lake NT, May 3, 1985. Record high flows of the Hay River and ice jams caused serious flooding, requiring the evacuation of West Channel residents. Ice jams, spring runoff, minor damages, one injury."
1,43,0,,,0,0,,7,28,7,1984,t,Summer,7,28,7,1984,t,Summer,Tornado,Meteorological - Hydrological,Natural,Disaster,0,0,Eastern,ON,Canada,t,"Eastern Ontario and Western Quebec, July 15, 1984. 1 dead, 43 injured; destruction of 300 houses. Québec: Sheenboro, Blue Sea Lake, Bouchette, Caymant Region of Outaouais. In Québec, 37 houses were damaged, 10 houses destroyed."
0,30,0,,,0,0,,7,35,9,1984,t,Autumn,7,35,9,1984,t,Autumn,Tornado,Meteorological - Hydrological,Natural,Disaster,0,0,London,ON,Canada,t,"London ON, September 2,1984. 30 injured."
0,0,0,,,0,0,,6,40,10,1984,t,Autumn,6,40,10,1984,t,Autumn,Winter Storm,Meteorological - Hydrological,Natural,Disaster,0,0,,AB,Canada,t,"Alberta, October 1984."
0,0,200,,,0,0,,2,1,1,1985,f,Winter,2,1,1,1985,f,Winter,Vehicle Release,Hazardous Chemicals,Technology,Incident,0,0,Smiths Falls,ON,Canada,t,"Smiths Falls ON, 1985. A truck accident at Smiths Falls, Ontario, resulted in the spill of dangerous goods, requiring the evacuation of hundreds of people."
5,0,0,,,0,0,,4,41,10,1984,f,Autumn,5,41,10,1984,f,Autumn,Hurricane / Typhoon / Tropical Storm,Meteorological - Hydrological,Natural,Disaster,0,0,,,Canada,t,"West Coast of British Columbia, October 11-12, 1984. A storm unexpectedly formed from the remnants of typhoon Odgen and caused the deaths of 5 fishermen."
0,0,30,,,0,0,,6,8,2,1985,t,Winter,6,9,3,1985,t,Spring,Flood,Meteorological - Hydrological,Natural,Disaster,0,0,Chatham,ON,Canada,t,"Chatham ON, February 23 - March 2, 1985. The city of Chatham and agricultural land in Dover and Raleigh Townships downstream of Chatham experienced widespread flooding due to a combination of mild temperatures leading to snowmelt; the Thames River and McGregor and Indian Creeks overflowed due to snowmelt runoff; an estimated 1180 homes experienced flooding; a dam was damaged; an Ontario Provincial Police helicopter was used to evacuate 30 people in outlying areas."
5,0,0,16390000,1560952.4,0,0,16390000,4,22,5,1985,f,Spring,4,22,5,1985,f,Spring,Storms and Severe Thunderstorms,Meteorological - Hydrological,Natural,Disaster,0,0,Wdsor,ON,Canada,t,"Windsor-Leamington ON, May 30, 1985. Golf-ball sized hailstones smashed greenhouses and flattened crops."
0,0,0,,,0,0,,3,18,5,1985,f,Spring,6,35,8,1985,t,Summer,Drought,Meteorological - Hydrological,Natural,Disaster,0,0,,,Canada,t,"Western Canada, 1985. Second drought year in a row; one of the worst agricultural droughts to occur in the Prairies;  insect infestations. On June 8, there was a wind and dust storm, heavy soil erosion, buildings and transmission lines were damaged."
329,0,0,,,0,0,,7,25,6,1985,t,Winter,7,25,6,1985,t,Winter,Bomb Attacks,Terrorist,Conflict,Incident,0,0,,,Canada,t,"Ireland (west coast), June 23, 1985. 329 dead (280 Canadians): Air India flight 182 en route from Toronto to India crashed in the North Atlantic: the crash was caused by a terrorist bomb."
0,0,1000,,,0,0,,2,4,1,1986,f,Winter,2,4,1,1986,f,Winter,Fire,Hazardous Chemicals,Technology,Incident,0,0,Stoney Creek,ON,Canada,t,"Stoney Creek ON, 1986. Required the evacuation of 1000 residents due to a fire in an insecticide plant."
23,71,0,,,0,0,,6,6,2,1986,t,Winter,6,6,2,1986,t,Winter,Rail,Transportation accident,Technology,Incident,0,0,Hton,AB,Canada,t,"Hinton AB, February 8, 1986. 23 dead: 71 injured. A westbound CN freight train collided with an eastbound VIA Rail passenger train on the CN main line, 17.6 kilometres east of Hinton."
0,0,0,,,0,0,,7,13,3,1985,t,Spring,6,14,4,1985,t,Spring,Flood,Meteorological - Hydrological,Natural,Disaster,0,0,Lake Erie,ON,Canada,t,"Lake Erie ON, March 31 and April 6, 1985. Two separate storms hit the shoreline of Lake Erie; hardest hit were Point Pelee and Long Point located along the shore of the lake; the storms destroyed cottages, washed out access roads, eroded beaches, uprooted trees and breached dikes."
12,500,800,83992000,7999238.1,0,0,83992000,5,22,5,1985,f,Spring,5,22,5,1985,f,Spring,Tornado,Meteorological - Hydrological,Natural,Disaster,0,0,Hopeville to Barrie,ON,Canada,t,"Hopeville to Barrie ON, May 31, 1985; 12 dead, hundreds injured; 800 homeless. More than 100 buildings were damaged, 300 houses were also destroyed. Severe thunderstorms and hail. Power outages, damage to 150 farms."
0,0,5000,,,0,0,,1,14,3,1986,f,Spring,1,14,3,1986,f,Spring,Derailment Release,Hazardous Chemicals,Technology,Incident,0,0,Timms,ON,Canada,t,"Timmins ON, March 31, 1986. 4500-5000 evacuated; a railway tank car leaked thousands of litres of gasoline into storm sewers prompting an evacuation. The gas fumes resulted in several explosions and the destruction of two homes."
0,0,0,,,0,0,,3,52,12,1986,f,Winter,3,52,12,1986,f,Winter,Winter Storm,Meteorological - Hydrological,Natural,Disaster,0,0,Eastern,ON,Canada,t,"Eastern Ontario and Southwestern Quebec, December 24, 1986. 1 in 4 homes in Ottawa were left without electricity after 30 mm of freezing rain fell in 14 hours."
0,0,0,,,0,0,,1,27,7,1985,f,Summer,1,27,7,1985,f,Summer,Wildfire,Meteorological - Hydrological,Natural,Disaster,0,0,Northeast of Vancouver,BC,Canada,t,"Northeast of Vancouver BC, July 1985.  During the same year, the Prairie provinces were struck with a severe drought (see 1985.002). During July, in northeast of Vancouver; a forest fire destroyed half a million acres of timberland.  One of the worst forest fires seasons on record.  Greater than 240,000 hectares of prime forest land burned.  More than 6,300 fire-fighters battling blazes.  The number of fires recorded in BC in 1985 were 3604."
0,0,0,,,0,0,,1,49,12,1985,f,Winter,1,49,12,1985,f,Winter,Flood,Meteorological - Hydrological,Natural,Disaster,0,0,Lake Huron,ON,Canada,t,"Lake Huron and Lake Erie ON, December 2, 1985. A storm with winds gusting up to 100 km/h severely affected shorelines with western exposures; erosion occurred on Lake Huron; on the eastern end of Lake Erie, cottages were destroyed; property and shore protection structures were damaged."
0,0,0,,,0,0,,5,31,8,1986,f,Summer,5,31,8,1986,f,Summer,Flood,Meteorological - Hydrological,Natural,Disaster,0,0,,,Canada,t,"East Central British Columbia, 1986. (Noeick River)"
0,0,0,,,0,0,,3,1,1,1986,f,Winter,3,1,1,1986,f,Winter,Landslide,Geological,Natural,Disaster,0,0,Brantford,ON,Canada,t,"Brantford ON, 1986."
0,0,0,0,0,0,0,,3,1,1,1986,f,Winter,3,1,1,1986,f,Winter,Drought,Meteorological - Hydrological,Natural,Disaster,0,0,,,Canada,t,"Prairie Provinces, 1986. Severe and widespread surface water droughts reported on the Prairies."
0,0,0,,,,,,4,46,11,1992,f,Autumn,5,46,11,1992,f,Autumn,Storm - Unspecified / Other,Meteorological - Hydrological,Natural,Disaster,0,0,,ON,Canada,t,"Ontario and Quebec, November 12-13, 1992."
0,0,750,,,0,0,,7,13,3,1986,t,Spring,2,14,4,1986,f,Spring,Flood,Meteorological - Hydrological,Natural,Disaster,0,0,Riviere Chaudière,QC,Canada,t,"Rivière Chaudière QC, March 30 - April 1, 1986. Communities along the Rivière Chaudière experienced flooding during the 1986 spring thaw; heavy rain and ice jams contributed to flooding which forced about 750 people to evacuate; an estimated 460 businesses and homes were flooded along the river; the communities of Saint-Georges, Beauceville, Saint-Joseph, Sainte-Marie, Scott, Breakeyville, Saint-Étienne, and Saint-Lambert were directly affected by the flood."
0,0,800,,,0,0,,3,20,5,1987,f,Spring,3,20,5,1987,f,Spring,Wildfire,Meteorological - Hydrological,Natural,Disaster,0,0,Valrita-Harty,ON,Canada,t,"Valrita-Harty ON, 1987. Entire village of 800 evacuated due to wildfire."
34,0,0,,,0,0,,2,47,11,1987,f,Autumn,2,47,11,1987,f,Autumn,Marine,Transportation accident,Technology,Incident,0,0,400 km off Cape Race,NL,Canada,t,"400 km off Cape Race NL, 1987.  Spanish Fishing Trawler Hosanna I sinks in the Atlantic Ocean: 34 dead."
7,0,0,,,0,0,,1,13,3,1987,f,Spring,1,13,3,1987,f,Spring,Avalanche,Meteorological - Hydrological,Natural,Disaster,0,0,Blue River,BC,Canada,t,"Blue River BC, March 23, 1987. An avalanche took the lives of 6 American heli-skiers and their Canadian guide."
455,,,0,0,,,,1,31,7,2009,f,Summer,1,32,8,2009,f,Summer,Heat Event,Meteorological - Hydrological,Natural,Disaster,0,0,Vancouver,BC,Canada,t,"Vancouver and Fraser BC, June 27 to August 3, 2009. Temperatures of up to 34.4 degrees centigrade were measured at Vancouver International Airport during an eight-day period from July 27 to August 3. According to the Fraser and Vancouver Health Authorities, in the past during the same eight-day period from July 27 to August 3, the average number of deaths was 321, but in 2009 during this time, there was a registered 455 deaths. It is believe that the heat greatly contributed towards the unusually high number of deaths."
0,0,2543,699884000,35023386.2,699884000,,,2,16,4,2011,f,Spring,5,24,6,2011,f,Winter,Flood,Meteorological - Hydrological,Natural,Disaster,0,0,Assiboe,MB,Canada,t,"Assiniboine, Roseau, and Red Rivers MB, April 19 to June 17, 2011. By April 28, flooding resulted in 15 communities declaring states of emergency while 1,772 individuals had been evacuated province wide. There were 1,547 evacuees who were from First Nations communities. Indigenous and Northern Affairs Canada (INAC) worked collaboratively with First Nations communities to develop flood action plans with pre-emptive activities.  As of June 15, 2,543 individuals had been evacuated and 32 communities had declared states of emergency. Estimated costs from the Province  is approximately $100 million and the estimated federal share is approximately $87.5 million."
,,203,0,0,,,,2,7,2,2011,f,Winter,5,8,2,2011,f,Winter,Disturbance / Demonstrations,Civil Incident,Conflict,Incident,0,0,,,Canada,t,"Libya, February 15-25, 2011. Qaddafi security services attempted to repress a series of peaceful protests, beginning on February 15. Within one week, the small uprising had spread across Libya, and Qaddafi’s regime struggled to retain control of the country. The government responded to continued uprisings with censorship, blocking of communications, imprisonment, military force and violence. The situation escalated into an armed conflict with an established coalition between rebel groups. As of February 25, more than 203 Canadians had been evacuated from Libya to nearby Malta. On June 14, the Minister of International Cooperation, Beverly J. Oda, announced additional humanitarian assistance. Canada’s total assistance in response to the crisis in Libya was $10.6 million."
,,12055,552960000,27671059.2,52960000,,500000000,7,19,5,2011,t,Spring,7,20,5,2011,t,Spring,Wildfire,Meteorological - Hydrological,Natural,Disaster,0,0,Slave Lake,AB,Canada,t,"Slave Lake AB, May 15 to May 22, 2011. Fortynine wildfires in north-central Alberta burned across the Lesser Slave River Region, prompting one of the most destructive wildfires in Canadian history. A state of emergency was declared by the Municipal District of Lesser Slave River No. 124 on May 15, after a wildfire that originated in the town of Slave Lake began to spread uncontrollably, affecting surrounding communities. The wildfire devastated the town of Slave Lake, where 374 buildings were destroyed and 52 damaged by the flames. Approximately 7000 people were evacuated from the town of Slave Lake and 735 individuals and families lost their homes. Outside of the town of Slave Lake, 59 other buildings were destroyed and 32 were damaged. Other affected communities include High Prairie, Little Buffalo, Red Earth Creek, Loon Lake First Nation (FN), Whitefish Lake FN and Woodland Cree FN. Penn West Petroleum, Exall Energy Corp. and Canadian Natural Resources Ltd. halted drilling in the region, suspended production and evacuated their employees. Canadian National (CN) Railway also halted their services in the region. By May 19, the number of evacuees rose to approximately 12,055. The total cost in damages was estimated at over $500 million."
0,144,0,0,0,,,,3,24,6,2011,f,Winter,4,24,6,2011,f,Winter,Rioting,Civil Incident,Conflict,Incident,0,0,Vancouver,BC,Canada,t,"Vancouver BC, June 15-16, 2011. Following the loss of game seven in the Stanley Cup finals to the Boston Bruins, Vancouver Canucks fans took to the streets and rioting ensued. There were 140 people taken to hospital with minor injuries while four people sustained serious injuries. Businesses along Robson St. and West Georgia St. were damaged (smashed windows, looting, and vandalism) while cars nearby were set on fire."
0,0,1651,81612000,4084003.3,81612000,,,7,15,4,2011,t,Spring,3,25,6,2011,f,Winter,Flood,Meteorological - Hydrological,Natural,Disaster,0,0,Montérégie,QC,Canada,t,"Montérégie QC, April 17 to June 22, 2011. Early spring melt along with rainy weather between March and May led to historic flooding in the Montérégie region of Quebec. Communities in the Richelieu Valley experienced heavy rainfall from March to May, including Montreal where it rained 182 per cent above average during that time. Starting April 18 to 24, nine municipalities were affected by flooding. Rising water levels in the Richelieu River caused flooding and damages to an additional 16 municipalities, including Sainte-Anne-de-Sabrevios where 400 homes were damaged and Saint-Paul-de-l’Île-aux-Noix where 200 homes were damaged. From April to June, over 40 municipalities in the Montérégie region were affected by flooding and by May 6, 11 municipalities declared states of emergency. On May 23, the Richelieu River set a new all-time record water level of 30.7 metres, due to several days of intense rain. Most significantly impacted by the flooding was Saint-Jean-sur Richelieu where a over 3000 homes were flooded and approximately 1000 people were evacuated from their homes. In total, the floods affected 3,927 people and forced the evacuation of approximately 1,651 people from their homes."
0,0,440,0,0,,,,7,23,6,2011,t,Winter,2,24,6,2011,f,Winter,Wildfire,Meteorological - Hydrological,Natural,Disaster,0,0,Hall Lake,SK,Canada,t,"Hall Lake SK, June 12-14, 2011. On June 12, the Saskatchewan Emergency Management Organization reported a 25 to 40 hectare wildfire burning approximately three to four kilometers from the La Ronge First Nation subcommunity of Hall Lake. In total, there were 440 residents evacuated. As of June 14, the wildfire was no longer considered to be a direct threat to residents, and the evacuation order was lifted."
0,0,1137,0,0,,,,4,22,6,2011,f,Winter,4,23,6,2011,f,Winter,Wildfire,Meteorological - Hydrological,Natural,Disaster,0,0,Wollaston Lake,SK,Canada,t,"Wollaston Lake SK, June 2 to 9, 2011. On June 1, the Saskatchewan Emergency Organization reported that a 500 hectare fire was burning approximately 1.5 kilometres southwest of the community of Wollaston Lake. Winds blowing in from the southwest caused the fire and smoke to encroach upon the community, and the fire increased to 1,100 hectares by the following day. On June 2, a total of 1,137 residents were evacuated but damages to structures had not been reported at that time."
0,0,2937,0,0,,,,4,22,6,2011,f,Winter,6,27,7,2011,t,Summer,Flood,Meteorological - Hydrological,Natural,Disaster,0,0,Southern,MB,Canada,t,"Southern Manitoba, June 2 to July 9, 2011. On June 3, 1,961 individuals were evacuated from the Ochre River, Alonsa, and Sioux Valley First Nations, and 37 communities declared local states of emergency due to extensive flooding.  Another 45 residences were given mandatory evacuation orders in the Dauphin Lake, Ochre River/Cresent Beach area on June 4. On June 6, the Sastachewan Watershed Authority released a large amount of water from the Tobin Lake Dam, which flows towards the flood zone.  By June 6, 40 communities were under a state of local emergency with a total of 2,058 evacuees registered through the Canadian Red Cross and the Manitoba Association of Native Firefighters (MANFF). Effective June 28, there were a total of 2,937 evacuees, 42 local declared States of Emergency with 13 of these being First Nations communities. On July 9, evacuation orders were lifted for Portage La Prairie, Souris, Wawanesa, and Glenwood."
